{
  "id": "msg_NORMALIZED",
  "type": "message",
  "role": "assistant",
  "content": [
    {
      "type": "tool_use",
      "id": "toolu_NORMALIZED",
      "name": "get_weather",
      "input": {
        "location": "Tokyo",
        "units": "celsius"
      }
    }
  ],
  "model": "claude-sonnet-4-5-thinking",
  "stop_reason": "tool_use",
  "stop_sequence": null,
  "usage": {
    "input_tokens": 25,
    "output_tokens": 12,
    "cache_read_input_tokens": 0,
    "cache_creation_input_tokens": 0
  }
}
