{
  "id": "msg_NORMALIZED",
  "type": "message",
  "role": "assistant",
  "content": [
    {
      "type": "thinking",
      "thinking": "The user is asking about prime numbers. Let me think through this step by step.",
      "signature": ""
    },
    {
      "type": "text",
      "text": "A prime number is a natural number greater than 1 that has no positive divisors other than 1 and itself."
    }
  ],
  "model": "claude-sonnet-4-5-thinking",
  "stop_reason": "end_turn",
  "stop_sequence": null,
  "usage": {
    "input_tokens": 20,
    "output_tokens": 45,
    "cache_read_input_tokens": 0,
    "cache_creation_input_tokens": 0
  }
}
