{
  "id": "msg_08cached789pqr",
  "type": "message",
  "role": "assistant",
  "content": [
    {
      "type": "text",
      "text": "Based on the context provided earlier, I can help you with that specific question about the document."
    }
  ],
  "model": "claude-sonnet-4-5-thinking",
  "stop_reason": "end_turn",
  "stop_sequence": null,
  "usage": {
    "input_tokens": 150,
    "output_tokens": 28,
    "cache_read_input_tokens": 5000,
    "cache_creation_input_tokens": 0
  }
}
